{
  "$schema": "https://rmside.invalid/schemas/fixture-manifest/v1",
  "schemaVersion": "1.0.0",
  "compatibility": {
    "minimumMajor": 1,
    "maximumMajor": 1
  },
  "manifestId": "aoe2de-101.103.48987-content-completeness",
  "files": [
    {
      "path": "crates/rms-content/data/aoe2de-101.103.48987-content-completeness.json",
      "sha256": "9b2198e7e3844676b868406072f342b34f147516a7a027cf101dac08d4855d47",
      "authorship": "Import accounting generated by the project's content importer: counts, numeric slot identities and reviewed exclusion reasons only.",
      "license": "Neutral factual identifiers and counts",
      "sourceClassification": "sanitized-observation",
      "created": "2026-10-07",
      "containsGameContent": false,
      "transformation": "Every source object slot is emitted or excluded as source-absent, absent-from-gaia-table or class-sentinel; canonical hashes bind the native bindings and definitions consumed by the import.",
      "reviewer": "Project maintainer; reviewed with the complete support bundle of the verified 101.103.48987 profile"
    }
  ]
}
