{
  "$schema": "https://rmside.invalid/schemas/fixture-manifest/v1",
  "schemaVersion": "1.0.0",
  "compatibility": {
    "minimumMajor": 1,
    "maximumMajor": 1
  },
  "manifestId": "aoe2de-101.103.57257-implicit-definitions",
  "files": [
    {
      "path": "crates/rms-content/data/aoe2de-101.103.57257-implicit-definitions.json",
      "sha256": "a0720f98c1c23cf7210369f969867703b40a371cd236c5be5323c5e88a2e1a62",
      "authorship": "Normalized numeric RMS symbol facts generated by the shared strict parser from the definition file of a lawfully owned, version-verified game installation; no source lines, comments, formatting, or include bodies retained.",
      "license": "Neutral factual identifiers; no source expression retained",
      "sourceClassification": "sanitized-observation",
      "created": "2026-10-28",
      "containsGameContent": false,
      "transformation": "Strict-parser evaluation into a canonically sorted name-to-decimal-value JSON dictionary. An independent complete-file line audit agrees for all 1400 definitions in this version.",
      "reviewer": "Pending maintainer review; reproducible like the 48987 and 54800 bundles; the 101.103.57257 profile was verified on 2026-10-28"
    }
  ]
}
