{
  "$schema": "https://rmside.invalid/schemas/fixture-manifest/v1",
  "schemaVersion": "1.0.0",
  "compatibility": {
    "minimumMajor": 1,
    "maximumMajor": 1
  },
  "manifestId": "aoe2de-101.103.57257-native-bindings",
  "files": [
    {
      "path": "crates/rms-content/data/aoe2de-101.103.57257-native-bindings.json",
      "sha256": "abb0a4fea36a6d0dca5de28e81d7fdf421687774f3bfbbe26e38d6b64e65f0f6",
      "authorship": "Independently reviewed conclusions about identities the native executable compares in code for this behavior profile; not an extracted table. Every value equals the 48987 and 54800 bindings: the static diff of 54800 and 57257 finds the same comparisons and cliff tables.",
      "license": "Neutral factual identifiers; no source expression retained",
      "sourceClassification": "sanitized-observation",
      "created": "2026-10-28",
      "containsGameContent": false,
      "transformation": "The 48987 reviewed bindings with this profile's identity; each binding records one executable-owned identity or rule consumed by the importer, and the generation subset is stored in the content pack. Since 2026-10-04 it also names the building constructor's construction-site exemptions (masters 357 and 1188, classes 51 and 54), read from the executable of the 48987 and 54800 builds. Schema 1.2.0 also names the eight executable-owned object and resource roles used by ordinary post-RMS fallback player starts. Schema 1.3.0 also names the perimeter farm completion roles (parents 1893 and 1897, the ordered children 1899 then 1900, and resources 289, 288, 237, 238 and 239), read from the executable of the 48987 and 54800 builds.",
      "reviewer": "Pending maintainer review; reproducible like the 48987 and 54800 bundles; the 101.103.57257 profile was verified on 2026-10-28"
    }
  ]
}
