{
  "$schema": "https://rmside.invalid/schemas/fixture-manifest/v1",
  "schemaVersion": "1.0.0",
  "compatibility": {
    "minimumMajor": 1,
    "maximumMajor": 1
  },
  "manifestId": "aoe2de-101.103.54800-support-bundle",
  "files": [
    {
      "path": "crates/rms-content/data/aoe2de-101.103.54800-support-bundle.json",
      "sha256": "8985a4bcd8ba325627dfeba395da1060f17e19eaaeb1a49c1b6f019341c0ff60",
      "authorship": "Support-bundle manifest generated by the project's sanitizer.",
      "license": "Neutral identities and hashes",
      "sourceClassification": "sanitized-observation",
      "created": "2026-10-07",
      "containsGameContent": false,
      "transformation": "Binds the behavior profile, content pack, definitions, standard-include inventory, native bindings and completeness manifest by SHA-256; the sanitizer verifies its output with the packaged loader.",
      "reviewer": "Project maintainer; reproducible like the 48987 bundle; the 101.103.54800 profile was verified on 2026-10-04"
    }
  ]
}
