{
  "$schema": "https://rmside.invalid/schemas/fixture-manifest/v1",
  "schemaVersion": "1.0.0",
  "compatibility": {
    "minimumMajor": 1,
    "maximumMajor": 1
  },
  "manifestId": "aoe2de-101.103.48987-support-bundle",
  "files": [
    {
      "path": "crates/rms-content/data/aoe2de-101.103.48987-support-bundle.json",
      "sha256": "00cb7947aa9f9d8df7414ccbd27c58a9661ab5c2d0594e62d56abb1e83f96d4d",
      "authorship": "Support-bundle manifest generated by the project's sanitizer.",
      "license": "Neutral identities and hashes",
      "sourceClassification": "sanitized-observation",
      "created": "2026-10-07",
      "containsGameContent": false,
      "transformation": "Binds the behavior profile, content pack, definitions, standard-include inventory, native bindings and completeness manifest by SHA-256; the sanitizer verifies its output with the packaged loader.",
      "reviewer": "Project maintainer; reviewed with the complete support bundle of the verified 101.103.48987 profile"
    }
  ]
}
