{
  "$schema": "https://rmside.invalid/schemas/fixture-manifest/v1",
  "schemaVersion": "1.0.0",
  "compatibility": {
    "minimumMajor": 1,
    "maximumMajor": 1
  },
  "manifestId": "aoe2de-101.103.57257-standard-includes",
  "files": [
    {
      "path": "crates/rms-content/data/aoe2de-101.103.57257-standard-includes.json",
      "sha256": "5b06e1467096ab184bed366f46e1c4561e3f9ba7ddb3e154dc5561564b7b9836",
      "authorship": "Names-only standard include namespace derived from the resource tree of a lawfully owned, version-verified game installation; no include body or RMS library expression retained.",
      "license": "Factual relative identifiers and reserved basenames only",
      "sourceClassification": "sanitized-observation",
      "created": "2026-10-28",
      "containsGameContent": false,
      "transformation": "Bounded inventory of the 81 shared .inc resources at the build's canonical standard-resource root and includes folder, with case-insensitive filename union plus random_map.def.",
      "reviewer": "Pending maintainer review; reproducible like the 48987 and 54800 bundles; the 101.103.57257 profile was verified on 2026-10-28"
    }
  ]
}
