{
  "$schema": "https://rmside.invalid/schemas/fixture-manifest/v1",
  "schemaVersion": "1.0.0",
  "compatibility": {
    "minimumMajor": 1,
    "maximumMajor": 1
  },
  "manifestId": "aoe2de-101.103.48987-neutral-implicit-definitions",
  "files": [
    {
      "path": "crates/rms-content/data/aoe2de-101.103.48987-implicit-definitions.json",
      "sha256": "ab4cd9be07d77091090ee76ca8e233471b5a38cdafa9e0deb798cf53d8f7fa57",
      "authorship": "Normalized numeric RMS symbol facts generated by the shared strict parser from the definition file of a lawfully owned, version-verified game installation; no source lines, comments, formatting, or include bodies retained.",
      "license": "Neutral factual identifiers; no source expression retained",
      "sourceClassification": "sanitized-observation",
      "created": "2026-09-24",
      "containsGameContent": false,
      "transformation": "Strict-parser evaluation into a canonically sorted name-to-decimal-value JSON dictionary. An independent complete-file line audit agrees for all 1114 definitions in this verified version. Other versions must be parsed and reviewed separately.",
      "reviewer": "Project maintainer; reviewed with the complete support bundle of the verified 101.103.48987 profile"
    }
  ]
}
