{
  "$schema": "https://rmside.invalid/schemas/fixture-manifest/v1",
  "schemaVersion": "1.0.0",
  "compatibility": {
    "minimumMajor": 1,
    "maximumMajor": 1
  },
  "manifestId": "aoe2de-101.103.57257-content-completeness",
  "files": [
    {
      "path": "crates/rms-content/data/aoe2de-101.103.57257-content-completeness.json",
      "sha256": "ffa137795431cae68e841273d5d5c659654eb78abe8e2a1c9943cb8f2c5f5e94",
      "authorship": "Import accounting generated by the project's content importer: counts, numeric slot identities and reviewed exclusion reasons only.",
      "license": "Neutral factual identifiers and counts",
      "sourceClassification": "sanitized-observation",
      "created": "2026-10-28",
      "containsGameContent": false,
      "transformation": "Every source object slot is emitted or excluded as source-absent, absent-from-gaia-table or class-sentinel; canonical hashes bind the native bindings and definitions consumed by the import.",
      "reviewer": "Pending maintainer review; reproducible like the 48987 and 54800 bundles; the 101.103.57257 profile was verified on 2026-10-28"
    }
  ]
}
